{
  "id_elemento": "CTX-103",
  "tipo": "BOUNDED_CONTEXT",
  "nome": "Fixture — promovido sem destino",
  "estagio": "PROMOVIDO",
  "promoted_by": "SEM-001",
  "maturidade": "IMATURA",
  "fonte": ["EVD-0003"],
  "estado_epistemologico": "VALIDADO",
  "estado_tecnico": "NAO_MODELADO",
  "evidencia": {
    "source_evidence": {
      "comando_ou_metodo": "leitura direta",
      "resultado": "teste"
    },
    "semantic_evidence": "justificativa de teste",
    "approval_evidence": { "aprovador": "Davi Sermenho", "data": "2026-08-15" },
    "repository_evidence": { "action_ref": "SEM-001" }
  }
}
